"DESCRIPTION","DURATION IN MS","NAME","PARENT SUITE","START TIME","STATUS","STOP TIME","SUB SUITE","SUITE","TEST CLASS","TEST METHOD"
"","24422","Verify subnav links in temp profile","","2026-04-09","passed","2026-04-09","","","",""
"","23402","Create a shift by clearconnect","","2026-04-09","passed","2026-04-09","","","",""
"","74177","Create a shift in UI","","2026-04-09","broken","2026-04-09","","","",""
"","24389","Enable Flat Pay and Bill for Temp","","2026-04-09","passed","2026-04-09","","","",""
"","18543","Verify subnav links in client profile","","2026-04-09","passed","2026-04-09","","","",""
